{
  "schema_version": "1.0.0",
  "id": "id-example-0001",
  "created_at": "2026-07-26T12:00:00Z",
  "suite_id": "suite_id-example-0001",
  "suite_version": "1.0.0",
  "target_id": "target_id-example-0001",
  "target_digest": "sha256:aaaaaaaaaaaaaaaaaaaaaaaaaaaaaaaaaaaaaaaaaaaaaaaaaaaaaaaaaaaaaaaa",
  "dataset_id": "dataset_id-example-0001",
  "dataset_version": "1.0.0",
  "sample_count": 0,
  "metrics": {},
  "slices": [],
  "critical_failures": [],
  "gate_decision": "pass",
  "configuration_digest": "sha256:aaaaaaaaaaaaaaaaaaaaaaaaaaaaaaaaaaaaaaaaaaaaaaaaaaaaaaaaaaaaaaaa",
  "report_artifact": {
    "schema_version": "1.0.0",
    "id": "id-example-0001",
    "kind": "document",
    "uri": "https://example.org/artifact",
    "digest": "sha256:aaaaaaaaaaaaaaaaaaaaaaaaaaaaaaaaaaaaaaaaaaaaaaaaaaaaaaaaaaaaaaaa",
    "classification": "public",
    "created_at": "2026-07-26T12:00:00Z",
    "source_system": "source_system-example-0001"
  }
}
